{
  "allowed_tools": [
    "list_files",
    "read_file",
    "edit_file",
    "run_shell"
  ],
  "budgets": {
    "max_seconds": 300,
    "max_usd": 0.3,
    "step_budget": 12
  },
  "difficulty": "needs_iteration",
  "eval_level": "L2",
  "hidden_tests": [],
  "human_time_bucket": "hours",
  "prompt": "feat(context): 结构化 compaction —— 可逆、幂等、闭合",
  "provenance": {
    "contamination_status": "private",
    "min_model_cutoff": "2026-05",
    "mined_at": "2026-08-06T05:56:23.127410+00:00",
    "mined_from_commit": "79fc8e893c8262c45fbff0208efaac87402e39de"
  },
  "raw_prompt": "feat(context): 结构化 compaction —— 可逆、幂等、闭合",
  "rubric": null,
  "schema_version": 2,
  "status": "draft",
  "suite": "coding-mined",
  "task_id": "mined-79fc8e8-feat-context-compaction",
  "verifier": {
    "argv": [
      "python",
      "-m",
      "pytest",
      "-q",
      "tests/test_admission_gate.py",
      "tests/test_compaction.py"
    ],
    "clean_env": true,
    "cwd": ".",
    "network": "deny",
    "timeout_s": 120.0
  },
  "visible_tests": [
    "tests/test_admission_gate.py",
    "tests/test_compaction.py"
  ],
  "workspace": {
    "archive_sha256": "sha256:81ee83ca8c085dd8ddd0172261923bc5063598ee5c5573db3dfb046cf699e1a4",
    "base_commit": "9607aee71f87a1cf2c9e846cb5834bba8ae606b9",
    "kind": "git_archive",
    "overlay_paths": [
      "tests/test_admission_gate.py",
      "tests/test_compaction.py"
    ]
  }
}
