{
  "allowed_tools": [
    "list_files",
    "read_file",
    "edit_file",
    "run_shell"
  ],
  "budgets": {
    "max_seconds": 300,
    "max_usd": 0.3,
    "step_budget": 12
  },
  "difficulty": "multi_file",
  "eval_level": "L2",
  "hidden_tests": [],
  "human_time_bucket": "minutes",
  "prompt": "feat(session): session v2 目录 + append-only，写入量 O(n²) -> O(n)",
  "provenance": {
    "contamination_status": "private",
    "min_model_cutoff": "2026-05",
    "mined_at": "2026-08-06T05:55:48.621563+00:00",
    "mined_from_commit": "976f8a25d4186ca544dafa08fafd24e983d87dae"
  },
  "raw_prompt": "feat(session): session v2 目录 + append-only，写入量 O(n²) -> O(n)",
  "rubric": null,
  "schema_version": 2,
  "status": "draft",
  "suite": "coding-mined",
  "task_id": "mined-976f8a2-feat-session-session-v2-append-only-o-n-",
  "verifier": {
    "argv": [
      "python",
      "-m",
      "pytest",
      "-q",
      "tests/test_approval.py",
      "tests/test_moss.py",
      "tests/test_security.py",
      "tests/test_session_store.py",
      "tests/test_session_store_v2.py"
    ],
    "clean_env": true,
    "cwd": ".",
    "network": "deny",
    "timeout_s": 120.0
  },
  "visible_tests": [
    "tests/test_approval.py",
    "tests/test_moss.py",
    "tests/test_security.py",
    "tests/test_session_store.py",
    "tests/test_session_store_v2.py"
  ],
  "workspace": {
    "archive_sha256": "sha256:e5ef5de2d43866fbbd9fe9767130a311ef661c2f152d91056275f65b26d5d2be",
    "base_commit": "b37ad19c7dedebbaa3d79d4f7c63c1cc8aca4700",
    "kind": "git_archive",
    "overlay_paths": [
      "tests/test_approval.py",
      "tests/test_moss.py",
      "tests/test_security.py",
      "tests/test_session_store.py",
      "tests/test_session_store_v2.py"
    ]
  }
}
